/h/angelo/single-cell-proj/repo/team_single_cell/experiments/jobs
gpu095
Sun Dec 18 14:07:39 EST 2022
wandb: Starting wandb agent 🕵️
2022-12-18 14:07:49,925 - wandb.wandb_agent - INFO - Running runs: []
2022-12-18 14:07:50,110 - wandb.wandb_agent - INFO - Agent received command: run
2022-12-18 14:07:50,110 - wandb.wandb_agent - INFO - Agent starting run with config:
	atac_dim: 5000
	atac_weight: 11.532894810528528
	epochs: 20
	gex_dim: 2500
	gex_weight: 77.48778296555727
	init: he
	latent_dim: 64
	lr: 0.001
	model: [[1000, 800, 600, 400, 200], [10, 30, 50, 100, 160], [1200, 900, 600, 400, 150], [15, 40, 60, 100, 180]]
	weight_decay: 0.048680667600341565
2022-12-18 14:07:50,120 - wandb.wandb_agent - INFO - About to run command: /usr/bin/env python gex_atac_sweep.py --atac_dim=5000 --atac_weight=11.532894810528528 --epochs=20 --gex_dim=2500 --gex_weight=77.48778296555727 --init=he --latent_dim=64 --lr=0.001 "--model=[[1000, 800, 600, 400, 200], [10, 30, 50, 100, 160], [1200, 900, 600, 400, 150], [15, 40, 60, 100, 180]]" --weight_decay=0.048680667600341565
2022-12-18 14:07:55,145 - wandb.wandb_agent - INFO - Running runs: ['frubsfny']
wandb: Currently logged in as: ange1o5 (team-single-cell). Use `wandb login --relogin` to force relogin
wandb: WARNING Ignored wandb.init() arg project when running a sweep.
wandb: WARNING Ignored wandb.init() arg entity when running a sweep.
wandb: Tracking run with wandb version 0.13.7
wandb: Run data is saved locally in /ssd003/home/angelo/single-cell-proj/repo/team_single_cell/experiments/scripts/wandb/run-20221218_140758-frubsfny
wandb: Run `wandb offline` to turn off syncing.
wandb: Syncing run autumn-sweep-260
wandb: ⭐️ View project at https://wandb.ai/team-single-cell/gex_atac_sweep
wandb: 🧹 View sweep at https://wandb.ai/team-single-cell/gex_atac_sweep/sweeps/j1snhit4
wandb: 🚀 View run at https://wandb.ai/team-single-cell/gex_atac_sweep/runs/frubsfny
 UserWarning:/h/angelo/miniconda3/envs/single_cell_env/lib/python3.7/site-packages/scanpy/preprocessing/_highly_variable_genes.py:64: `flavor='seurat_v3'` expects raw count data, but non-integers were found.
Trying to set attribute `._uns` of view, copying.
Trying to set attribute `.var` of view, copying.
2022-12-18 14:18:59.656761: I tensorflow/core/platform/cpu_feature_guard.cc:193] This TensorFlow binary is optimized with oneAPI Deep Neural Network Library (oneDNN) to use the following CPU instructions in performance-critical operations:  SSE4.1 SSE4.2 AVX AVX2 AVX512F FMA
To enable them in other operations, rebuild TensorFlow with the appropriate compiler flags.
 FutureWarning:/h/angelo/miniconda3/envs/single_cell_env/lib/python3.7/site-packages/anndata/_core/anndata.py:1228: The `inplace` parameter in pandas.Categorical.reorder_categories is deprecated and will be removed in a future version. Reordering categories will always return a new Categorical object.
... storing 'feature_types' as categorical
 FutureWarning:/h/angelo/miniconda3/envs/single_cell_env/lib/python3.7/site-packages/anndata/_core/anndata.py:1228: The `inplace` parameter in pandas.Categorical.reorder_categories is deprecated and will be removed in a future version. Reordering categories will always return a new Categorical object.
... storing 'gene_id' as categorical
Reading dataset...
Feature selecting GEX...
Feature selecting ATAC...

New GEX dim: 2500;
New ATAC dim: 5001;
AnnData dataset's shape: (69249, 7501)

Initializing dataset and dataloader...
The order of labels: ['s1d1', 's1d1', 's1d1', 's1d1', 's1d1', ..., 's4d9', 's4d9', 's4d9', 's4d9', 's4d9']
Length: 69249
Categories (13, object): ['s1d1', 's1d2', 's1d3', 's2d1', ..., 's3d10', 's4d1', 's4d8', 's4d9']
The device: cuda;

The model: DeepGexAtacMultiModalAutoencoder(
  (gex_encoder): Sequential(
    (0): Linear(in_features=2500, out_features=1000, bias=True)
    (1): BatchNorm1d(1000, eps=1e-05, momentum=0.1, affine=True, track_running_stats=True)
    (2): ReLU()
    (3): Dropout(p=0.1, inplace=False)
    (4): Linear(in_features=1000, out_features=800, bias=True)
    (5): BatchNorm1d(800, eps=1e-05, momentum=0.1, affine=True, track_running_stats=True)
    (6): ReLU()
    (7): Linear(in_features=800, out_features=600, bias=True)
    (8): BatchNorm1d(600, eps=1e-05, momentum=0.1, affine=True, track_running_stats=True)
    (9): ReLU()
    (10): Dropout(p=0.1, inplace=False)
    (11): Linear(in_features=600, out_features=400, bias=True)
    (12): BatchNorm1d(400, eps=1e-05, momentum=0.1, affine=True, track_running_stats=True)
    (13): ReLU()
    (14): Linear(in_features=400, out_features=200, bias=True)
    (15): BatchNorm1d(200, eps=1e-05, momentum=0.1, affine=True, track_running_stats=True)
    (16): ReLU()
    (17): Dropout(p=0.1, inplace=False)
    (18): Linear(in_features=200, out_features=32, bias=True)
    (19): ReLU()
  )
  (atac_encoder): Sequential(
    (0): Linear(in_features=5001, out_features=1200, bias=True)
    (1): BatchNorm1d(1200, eps=1e-05, momentum=0.1, affine=True, track_running_stats=True)
    (2): ReLU()
    (3): Dropout(p=0.1, inplace=False)
    (4): Linear(in_features=1200, out_features=900, bias=True)
    (5): BatchNorm1d(900, eps=1e-05, momentum=0.1, affine=True, track_running_stats=True)
    (6): ReLU()
    (7): Linear(in_features=900, out_features=600, bias=True)
    (8): BatchNorm1d(600, eps=1e-05, momentum=0.1, affine=True, track_running_stats=True)
    (9): ReLU()
    (10): Dropout(p=0.1, inplace=False)
    (11): Linear(in_features=600, out_features=400, bias=True)
    (12): BatchNorm1d(400, eps=1e-05, momentum=0.1, affine=True, track_running_stats=True)
    (13): ReLU()
    (14): Linear(in_features=400, out_features=150, bias=True)
    (15): BatchNorm1d(150, eps=1e-05, momentum=0.1, affine=True, track_running_stats=True)
    (16): ReLU()
    (17): Dropout(p=0.1, inplace=False)
    (18): Linear(in_features=150, out_features=32, bias=True)
    (19): ReLU()
  )
  (gex_decoder): Sequential(
    (0): Linear(in_features=64, out_features=10, bias=True)
    (1): BatchNorm1d(10, eps=1e-05, momentum=0.1, affine=True, track_running_stats=True)
    (2): ReLU()
    (3): Dropout(p=0.1, inplace=False)
    (4): Linear(in_features=10, out_features=30, bias=True)
    (5): BatchNorm1d(30, eps=1e-05, momentum=0.1, affine=True, track_running_stats=True)
    (6): ReLU()
    (7): Linear(in_features=30, out_features=50, bias=True)
    (8): BatchNorm1d(50, eps=1e-05, momentum=0.1, affine=True, track_running_stats=True)
    (9): ReLU()
    (10): Dropout(p=0.1, inplace=False)
    (11): Linear(in_features=50, out_features=100, bias=True)
    (12): BatchNorm1d(100, eps=1e-05, momentum=0.1, affine=True, track_running_stats=True)
    (13): ReLU()
    (14): Linear(in_features=100, out_features=160, bias=True)
    (15): BatchNorm1d(160, eps=1e-05, momentum=0.1, affine=True, track_running_stats=True)
    (16): ReLU()
    (17): Dropout(p=0.1, inplace=False)
    (18): Linear(in_features=160, out_features=2500, bias=True)
    (19): ReLU()
  )
  (atac_decoder): Sequential(
    (0): Linear(in_features=64, out_features=15, bias=True)
    (1): BatchNorm1d(15, eps=1e-05, momentum=0.1, affine=True, track_running_stats=True)
    (2): ReLU()
    (3): Dropout(p=0.1, inplace=False)
    (4): Linear(in_features=15, out_features=40, bias=True)
    (5): BatchNorm1d(40, eps=1e-05, momentum=0.1, affine=True, track_running_stats=True)
    (6): ReLU()
    (7): Linear(in_features=40, out_features=60, bias=True)
    (8): BatchNorm1d(60, eps=1e-05, momentum=0.1, affine=True, track_running_stats=True)
    (9): ReLU()
    (10): Dropout(p=0.1, inplace=False)
    (11): Linear(in_features=60, out_features=100, bias=True)
    (12): BatchNorm1d(100, eps=1e-05, momentum=0.1, affine=True, track_running_stats=True)
    (13): ReLU()
    (14): Linear(in_features=100, out_features=180, bias=True)
    (15): BatchNorm1d(180, eps=1e-05, momentum=0.1, affine=True, track_running_stats=True)
    (16): ReLU()
    (17): Dropout(p=0.1, inplace=False)
    (18): Linear(in_features=180, out_features=5001, bias=True)
    (19): Sigmoid()
  )
);
The dataset: <datasets.anndatadataset.AnnDataDataset object at 0x7fbec10beb90>;
The optimizer: Adam (
Parameter Group 0
    amsgrad: False
    betas: (0.9, 0.999)
    eps: 1e-08
    lr: 0.001
    weight_decay: 0.048680667600341565
);

Epoch 0 recon loss: 12898.7082349874
Epoch 1 recon loss: 12459.066178842
Epoch 2 recon loss: 11777.6542971252
Epoch 3 recon loss: 11562.0517752814
Epoch 4 recon loss: 11659.1110981825
Epoch 5 recon loss: 10523.5173246815
Epoch 6 recon loss: 11420.7704311398
Epoch 7 recon loss: 10521.6436851719
Epoch 8 recon loss: 10591.6119609991
Epoch 9 recon loss: 10262.1775931043
Epoch 10 recon loss: 10316.5759246984
Epoch 11 recon loss: 9908.3843716716
Epoch 12 recon loss: 9532.1181163047
Epoch 13 recon loss: 9574.8023188346
Epoch 14 recon loss: 8969.4589662091
Epoch 15 recon loss: 8588.8951397445
Epoch 16 recon loss: 8726.8020829335
Epoch 17 recon loss: 8435.0988220112
Epoch 18 recon loss: 8371.6707820267
Epoch 19 recon loss: 8212.9922084408

Latent space type: <class 'numpy.ndarray'>;
GEX encoded shape: torch.Size([69249, 32]);
ATAC encoded shape: torch.Size([69249, 32]);
Latent space shape: (69249, 64);

0.4647575523131877
   celltype_ari  celltype_ami  ...  batch_homogeneity  batch_complete
0      0.034682      0.204724  ...           0.848025         0.91203

[1 rows x 8 columns]
2022-12-18 14:22:48,680 - wandb.wandb_agent - INFO - Cleaning up finished run: frubsfny
wandb: Waiting for W&B process to finish... (success).
wandb: 
wandb: Run history:
wandb:  recon loss █▇▆▆▆▄▆▄▅▄▄▄▃▃▂▂▂▁▁▁
wandb: total_score ▁
wandb: 
wandb: Run summary:
wandb:  recon loss 8212.99221
wandb: total_score 0.46476
wandb: 
wandb: Synced autumn-sweep-260: https://wandb.ai/team-single-cell/gex_atac_sweep/runs/frubsfny
wandb: Synced 6 W&B file(s), 1 media file(s), 1 artifact file(s) and 0 other file(s)
wandb: Find logs at: ./wandb/run-20221218_140758-frubsfny/logs
2022-12-18 14:22:53,930 - wandb.wandb_agent - INFO - Agent received command: run
2022-12-18 14:22:53,931 - wandb.wandb_agent - INFO - Agent starting run with config:
	atac_dim: 10000
	atac_weight: 40.02944916150554
	epochs: 80
	gex_dim: 1000
	gex_weight: 55.67965617683964
	init: xavier
	latent_dim: 20
	lr: 0.0001
	model: [[1200, 400, 100], [50, 100, 200], [1600, 600, 120], [60, 100, 150]]
	weight_decay: 0.02735461660671661
2022-12-18 14:22:53,964 - wandb.wandb_agent - INFO - About to run command: /usr/bin/env python gex_atac_sweep.py --atac_dim=10000 --atac_weight=40.02944916150554 --epochs=80 --gex_dim=1000 --gex_weight=55.67965617683964 --init=xavier --latent_dim=20 --lr=0.0001 "--model=[[1200, 400, 100], [50, 100, 200], [1600, 600, 120], [60, 100, 150]]" --weight_decay=0.02735461660671661
2022-12-18 14:22:58,994 - wandb.wandb_agent - INFO - Running runs: ['nrxcjeq2']
wandb: Currently logged in as: ange1o5 (team-single-cell). Use `wandb login --relogin` to force relogin
wandb: WARNING Ignored wandb.init() arg project when running a sweep.
wandb: WARNING Ignored wandb.init() arg entity when running a sweep.
wandb: Tracking run with wandb version 0.13.7
wandb: Run data is saved locally in /ssd003/home/angelo/single-cell-proj/repo/team_single_cell/experiments/scripts/wandb/run-20221218_142300-nrxcjeq2
wandb: Run `wandb offline` to turn off syncing.
wandb: Syncing run twilight-sweep-414
wandb: ⭐️ View project at https://wandb.ai/team-single-cell/gex_atac_sweep
wandb: 🧹 View sweep at https://wandb.ai/team-single-cell/gex_atac_sweep/sweeps/j1snhit4
wandb: 🚀 View run at https://wandb.ai/team-single-cell/gex_atac_sweep/runs/nrxcjeq2
 UserWarning:/h/angelo/miniconda3/envs/single_cell_env/lib/python3.7/site-packages/scanpy/preprocessing/_highly_variable_genes.py:64: `flavor='seurat_v3'` expects raw count data, but non-integers were found.
Trying to set attribute `._uns` of view, copying.
Trying to set attribute `.var` of view, copying.
slurmstepd: error: *** JOB 8874689 ON gpu095 CANCELLED AT 2022-12-18T14:32:15 ***
